{"$schema":"https://json-schema.org/draft/2020-12/schema","title":"SourceTierBoundaries","type":"object","additionalProperties":false,"required":["registry_id","version","status","policy","source_tiers"],"properties":{"registry_id":{"type":"string"},"version":{"type":"string"},"status":{"type":"string"},"policy":{"type":"string"},"source_tiers":{"type":"array","minItems":9,"items":{"type":"object","required":["tier_id","authority_scope","proves","must_not_prove","allowed_use","forbidden_use"],"properties":{"tier_id":{"enum":["official_elementor_help","official_elementor_developer_docs","elementor_release_or_update_note","project_export","real_editor_capture","frontend_runtime","browser_computed_style","controlled_fixture","downstream_repo_evidence"]},"authority_scope":{"type":"string"},"proves":{"type":"array"},"must_not_prove":{"type":"array"},"allowed_use":{"type":"array"},"forbidden_use":{"type":"array"}}}}}}
