{"registry_id":"source-tier-boundaries.v0","version":"0.1.0","status":"foundation","policy":"Official Elementor docs prove documented platform capability only. They do not prove installed version availability, project feature enabled state, Elementor Pro availability, Admin/user permission, constructability, Builder execution, frontend runtime behavior, or production readiness.","source_tiers":[{"tier_id":"official_elementor_help","authority_scope":"bounded","proves":["documented_platform_capability"],"must_not_prove":["installed_version_availability","project_feature_enabled_state","elementor_pro_availability","admin_or_user_permission","constructability","builder_execution","frontend_runtime_behavior","production_readiness"],"allowed_use":["source_ref_for_capability","limitation_tracking","decision_context"],"forbidden_use":["silent_promotion_beyond_scope","production_readiness_claim"]},{"tier_id":"official_elementor_developer_docs","authority_scope":"bounded","proves":["documented_atomic_or_developer_contract"],"must_not_prove":["installed_version_availability","project_feature_enabled_state","elementor_pro_availability","admin_or_user_permission","constructability","builder_execution","frontend_runtime_behavior","production_readiness"],"allowed_use":["source_ref_for_developer_contract","limitation_tracking","export_shape_context"],"forbidden_use":["target_project_export_observed_claim","production_readiness_claim"]},{"tier_id":"elementor_release_or_update_note","authority_scope":"bounded","proves":["release_note_context","documented_release_claim"],"must_not_prove":["installed_version_availability","project_feature_enabled_state","elementor_pro_availability","admin_or_user_permission","constructability","builder_execution","frontend_runtime_behavior","production_readiness"],"allowed_use":["release_context","version_gate_context"],"forbidden_use":["roadmap_as_current_capability","production_readiness_claim"]},{"tier_id":"project_export","authority_scope":"bounded","proves":["saved_project_export_observed_within_export_scope"],"must_not_prove":["frontend_dom","computed_css","builder_execution","production_readiness"],"allowed_use":["saved_settings_styles_interactions_evidence","target_project_export_observation"],"forbidden_use":["frontend_dom_claim","computed_css_claim"]},{"tier_id":"real_editor_capture","authority_scope":"bounded","proves":["editor_state_observed_within_capture_scope"],"must_not_prove":["published_frontend_runtime","computed_css_finality","production_readiness"],"allowed_use":["editor_ui_observation","editor_preview_context"],"forbidden_use":["published_runtime_claim"]},{"tier_id":"frontend_runtime","authority_scope":"bounded","proves":["frontend_dom_observed_within_capture_scope"],"must_not_prove":["builder_execution_intent","production_readiness","all_viewports"],"allowed_use":["runtime_dom_evidence","interaction_trace_context"],"forbidden_use":["production_readiness_claim"]},{"tier_id":"browser_computed_style","authority_scope":"bounded","proves":["computed_style_observed_for_captured_node_viewport_state"],"must_not_prove":["saved_setting_source","production_readiness","uncaptured_viewports"],"allowed_use":["computed_css_evidence","runtime_correlation_input"],"forbidden_use":["saved_value_claim"]},{"tier_id":"controlled_fixture","authority_scope":"bounded","proves":["validator_behavior_for_fixture_scope"],"must_not_prove":["real_project_behavior","production_readiness","browser_runtime_truth"],"allowed_use":["schema_validator_test","deterministic_regression_test"],"forbidden_use":["real_project_truth_claim"]},{"tier_id":"downstream_repo_evidence","authority_scope":"bounded","proves":["downstream_repository_behavior_observed_if_inspected"],"must_not_prove":["kernel_local_claim_until_inspected","production_readiness"],"allowed_use":["downstream_rejection_evidence_only_when_inspected"],"forbidden_use":["uninspected_downstream_enforcement_claim"]}]}
